<!DOCTYPE signed-policy SYSTEM "bondixml.dtd">

<signed-policy>

 <Signature Id="SignatureExample" xmlns="http://www.w3.org/2000/09/xmldsig#"> 
   <SignedInfo> 
   <CanonicalizationMethod Algorithm="http://www.w2.org/2006/12/xml-c14n11"/> 
   <SignatureMethod Algorithm="http://www.w3.org/2001/04/xmldsig-more#rsa-sha256"/> 
   <Reference URI="Policy-1"> 
     <DigestMethod Algorithm="http://www.w3.org/2001/04/xmlenc#sha256"/> 
     <DigestValue>dGhpcyBpcyBub3QgYSBzaWduYXR1cmUK...</DigestValue> 
   </Reference> 
   <Reference URI="Policy-2"> 
     <DigestMethod Algorithm="http://www.w3.org/2001/04/xmlenc#sha256"/> 
     <DigestValue>dGhpcyBpcyBub3QgYSBzaWduYXR1cmUK...</DigestValue> 
   </Reference> 
   <Reference URI="Policy-3"> 
     <DigestMethod Algorithm="http://www.w3.org/2001/04/xmlenc#sha256"/> 
     <DigestValue>dGhpcyBpcyBub3QgYSBzaWduYXR1cmUK...</DigestValue> 
   </Reference> 
   <Reference URI="Policy-4"> 
     <DigestMethod Algorithm="http://www.w3.org/2001/04/xmlenc#sha256"/> 
     <DigestValue>dGhpcyBpcyBub3QgYSBzaWduYXR1cmUK...</DigestValue> 
   </Reference> 
   <Reference URI="Policy-5"> 
     <DigestMethod Algorithm="http://www.w3.org/2001/04/xmlenc#sha256"/> 
     <DigestValue>dGhpcyBpcyBub3QgYSBzaWduYXR1cmUK...</DigestValue> 
   </Reference> 
   <Reference URI="Policy-6"> 
     <DigestMethod Algorithm="http://www.w3.org/2001/04/xmlenc#sha256"/> 
     <DigestValue>dGhpcyBpcyBub3QgYSBzaWduYXR1cmUK...</DigestValue> 
   </Reference> 
   <Reference URI="Policy-7"> 
     <DigestMethod Algorithm="http://www.w3.org/2001/04/xmlenc#sha256"/> 
     <DigestValue>dGhpcyBpcyBub3QgYSBzaWduYXR1cmUK...</DigestValue> 
   </Reference> 
   <Reference URI="Policy-8"> 
     <DigestMethod Algorithm="http://www.w3.org/2001/04/xmlenc#sha256"/> 
     <DigestValue>dGhpcyBpcyBub3QgYSBzaWduYXR1cmUK...</DigestValue> 
   </Reference> 
   <Reference URI="Policy-9"> 
     <DigestMethod Algorithm="http://www.w3.org/2001/04/xmlenc#sha256"/> 
     <DigestValue>dGhpcyBpcyBub3QgYSBzaWduYXR1cmUK...</DigestValue> 
   </Reference> 
   <Reference URI="Policy-10"> 
     <DigestMethod Algorithm="http://www.w3.org/2001/04/xmlenc#sha256"/> 
     <DigestValue>dGhpcyBpcyBub3QgYSBzaWduYXR1cmUK...</DigestValue> 
   </Reference> 
   <Reference URI="Policy-11"> 
     <DigestMethod Algorithm="http://www.w3.org/2001/04/xmlenc#sha256"/> 
     <DigestValue>dGhpcyBpcyBub3QgYSBzaWduYXR1cmUK...</DigestValue> 
   </Reference> 
   <Reference URI="Policy-12"> 
     <DigestMethod Algorithm="http://www.w3.org/2001/04/xmlenc#sha256"/> 
     <DigestValue>dGhpcyBpcyBub3QgYSBzaWduYXR1cmUK...</DigestValue> 
   </Reference> 
   <Reference URI="Policy-13"> 
     <DigestMethod Algorithm="http://www.w3.org/2001/04/xmlenc#sha256"/> 
     <DigestValue>dGhpcyBpcyBub3QgYSBzaWduYXR1cmUK...</DigestValue> 
   </Reference> 
   <Reference URI="Policy-14"> 
     <DigestMethod Algorithm="http://www.w3.org/2001/04/xmlenc#sha256"/> 
     <DigestValue>dGhpcyBpcyBub3QgYSBzaWduYXR1cmUK...</DigestValue> 
   </Reference> 
   <Reference URI="Policy-15"> 
     <DigestMethod Algorithm="http://www.w3.org/2001/04/xmlenc#sha256"/> 
     <DigestValue>dGhpcyBpcyBub3QgYSBzaWduYXR1cmUK...</DigestValue> 
   </Reference> 
   <Reference URI="Policy-16"> 
     <DigestMethod Algorithm="http://www.w3.org/2001/04/xmlenc#sha256"/> 
     <DigestValue>dGhpcyBpcyBub3QgYSBzaWduYXR1cmUK...</DigestValue> 
   </Reference> 
   <Reference URI="Policy-17"> 
     <DigestMethod Algorithm="http://www.w3.org/2001/04/xmlenc#sha256"/> 
     <DigestValue>dGhpcyBpcyBub3QgYSBzaWduYXR1cmUK...</DigestValue> 
   </Reference> 
 </SignedInfo> 
   <SignatureValue>asdfkjlhxvczxnbcvnjahfjhsdfklahfdas</SignatureValue> 
   <KeyInfo> 
     <KeyValue>
       <DSAKeyValue> 
         <P> PValue </P><Q> QValue </Q><G> Gvalue </G><Y> laj?</Y>
       </DSAKeyValue>
       <RSAKeyValue>
           <Modulus>
               modulus
           </Modulus>
           <Exponent>
               exponent
           </Exponent>
       </RSAKeyValue>
     </KeyValue>
     <X509Data>
         <X509SubjectName> Subject name </X509SubjectName>
         <X509SKI> SKI </X509SKI>
     </X509Data>
   </KeyInfo> 
 </Signature>
 


<policy-set id="Policy-1">      
<policy-set combine="first-matching-target">
    <target>
        <subject>
            <subject-match attr="id">
                subject
            </subject-match>
        </subject>
        <subject>
            <subject-match attr="id" match="subject2" />
        </subject>
    </target>
    <policy>
        <target>
            <subject>
                <subject-match attr="id" match="subject" />
            </subject>
        </target>
        <rule effect="permit">
            <condition>
                <resource-match attr="resource-id">
                    resource
                </resource-match>
                <subject-match attr="version" match="3" />
            </condition>
        </rule>
    </policy>        
    <policy>
        <target>
            <subject>
                <subject-match attr="id" match="subject2" />
            </subject>
        </target>
        <rule effect="deny">
            <condition>
                <resource-match attr="resource-id">
                    resource
                </resource-match>                    
            </condition>
        </rule>
    </policy>    
</policy-set>
<policy-set >
    <target>
        <subject>
            <subject-match attr="id">
                subject3
            </subject-match>                    
        </subject>  
        <subject>
            <subject-match attr="id" match="subject4" />
        </subject>                 
    </target>
    <policy>             
        <rule effect="permit">
            <condition>
                <resource-match attr="resource-id">
                    resource2
                </resource-match>                
            </condition>
        </rule>
    </policy>        
    <policy>            
        <rule effect="deny">
            <condition>
                <resource-match attr="resource-id">
                    resource2
                </resource-match>                    
            </condition>
        </rule>
    </policy> 
    <policy>
        <target>
            <subject>
                <subject-match attr="id">
                    subject4
                </subject-match>                    
                <subject-match attr="version" match="4" />
            </subject>  
        </target>
        <rule effect="permit">
            <condition>
                <resource-match attr="resource-id">
                    resource4
                </resource-match>                    
            </condition>
        </rule>
    </policy>
</policy-set>    
<policy-set id="Policy-2" combine="first-matching-target">
    <target>      
        <subject>
            <subject-match attr="id" match="subject5" />
        </subject>                 
        <subject>
            <subject-match attr="id" match="subject6" />
        </subject>                 
    </target>
    <policy>    
        <target>
            <subject>
                <subject-match attr="id">
                    subject5
                </subject-match>                    
            </subject>              
        </target>
        <rule effect="permit">
            <condition combine="and">
                <resource-match attr="resource-id">
                    resource5
                </resource-match>                
                <subject-match attr="version" match="5" />
            </condition>
        </rule>
    </policy> 
    <policy>             
        <rule effect="permit">
            <condition combine="or">
                <resource-match attr="resource-id">
                    resource6
                </resource-match>                
                <subject-match attr="version" match="6" />
            </condition>
        </rule>
    </policy>  
</policy-set>

<policy-set id="Policy-3" combine="deny-overrides">
    <target>      
        <subject>
            <subject-match attr="id" match="subject7" />
        </subject>                                 
    </target>
    <policy>   
        <rule effect="permit">
            <condition combine="and">
                <resource-match attr="resource-id">
                    resource7
                </resource-match>    
                <condition combine="and">
                    <condition combine="or">
                        <subject-match attr="version" match="7" />
                        <subject-match attr="version" match="6" />
                    </condition>
                    <resource-match attr="author" match="author2" />
                </condition>
            </condition>
        </rule>
    </policy>   
    <policy>   
        <rule effect="permit">
            <condition combine="and">
                <resource-match attr="resource-id">
                    resource7
                </resource-match>    
                <condition combine="or">
                    <condition combine="or">
                        <subject-match attr="version" match="1" />
                        <subject-match attr="version" match="2" />
                    </condition>
                    <resource-match attr="author" match="author3" />
                </condition>
            </condition>
        </rule>
    </policy> 
    <policy>   
        <rule effect="deny">
            <condition combine="and">
                <resource-match attr="resource-id">
                    resource7
                </resource-match>    
                <condition combine="or">
                    <condition combine="or">
                        <subject-match attr="version" match="1" />
                        <subject-match attr="version" match="2" />
                    </condition>
                    <resource-match attr="author" match="author3" />
                </condition>
            </condition>
        </rule>